name,conferenceName,language,type,year,title,description,link
Тимофей Лавринюк,OdessaFrontend,russian,,2019,Перепись приложения. Нативного. На JS. Done.,,https://youtu.be/4DN3ctq7RDM
Никита Малик,OdessaFrontend,russian,,2019,We do not sow or Ivy is coming,,https://youtu.be/9EOOHaj5LBM
Владислав Балабаш,OdessaFrontend,russian,,2019,1000 и 1 блюдо из джаваскрипта,,https://youtu.be/hlip_L5RWrk
Денис Сурячковский,OdessaFrontend,russian,,2019,Highway to FPS or true animations in Angular,,https://youtu.be/ywBEtfKunu4
Иван Гончаров,Zlit Tech,ukranian,,2019,Why the future is GrachQL?,,https://youtu.be/jd3BpKv7LZ8?t=785
Андрей Чиж,Zlit Tech,russian,,2019,GraphQL API: Patterns,,https://youtu.be/jd3BpKv7LZ8?t=3195
Павел Черторогов,Zlit Tech,russian,,2019,5 подходов построения GraphQL-схем,,https://youtu.be/jd3BpKv7LZ8?t=6779
Александр Тарасенко,Zlit Tech,russian,,2019,Где и как вы еще не используете GraphQL,,https://youtu.be/jd3BpKv7LZ8?t=9755
Михайло Гавеля,Zlit Tech,ukranian,,2019,Add types for this please,,https://youtu.be/jd3BpKv7LZ8?t=13542
Роман Сенин,Zlit Tech,russian,,2019,GraphSQL – Third party API,,https://youtu.be/jd3BpKv7LZ8?t=15608
Виталий Паршиков,Zlit Tech,russian,,2019,Local state managment with Apollo,,https://youtu.be/jd3BpKv7LZ8?t=17277
Антон Феоктистов,Zlit Tech,russian,,2019,"GraphQL, котракты и выгорание",,https://youtu.be/jd3BpKv7LZ8?t=18567
Никита Галкин,Zlit Tech,russian,,2019,GraphSQL: Tools,,https://youtu.be/jd3BpKv7LZ8?t=19189
Максим Безуглин,Zlit Tech,russian,,2019,От заката до рассвета,,https://youtu.be/jd3BpKv7LZ8?t=20371
Prashant Palikhe,VinnytsiaJS,english,,2019,From code to pixels in a Blink,,https://youtu.be/p6pjZ-qzkuE
Paul Yuhnovich,VinnytsiaJS,english,,2019,A Universal Fusion of the Team,,https://youtu.be/x2xFAEhDncY
Наталья Теплухина,VinnytsiaJS,english,,2019,Vue + GraphQL,,https://youtu.be/3Wej2Z-EOak
Борис Могила,VinnytsiaJS,ukranian,,2019,ML + AR in js (to be or not to be),,https://youtu.be/vkrLhRPJwmI
Евгений Шемет,VinnytsiaJS,ukranian,,2019,React with Blackjack and Hooks,,https://youtu.be/jfCn56z1hNI
Кристина Ландвитович,VinnytsiaJS,ukranian,,2019,Tensorflow in Action,,https://youtu.be/hc0Vx4A9zXQ
Александр Ковтун,VinnytsiaJS,russian,,2019,Reactive programming. Svelte way,,https://youtu.be/BiP-7yeeEAA
Виктор Турский,VinnytsiaJS,russian,,2019,Language Independent Validation Rules 2.0,,https://youtu.be/URhJHdF2Z54
Milica Mihajlija,VinnytsiaJS,english,,2019,Fast future with WebAssembly,,https://youtu.be/E0xgeZP3dis
Андрей Штадлер,VinnytsiaJS,russian,,2019,Accessibility Through the Eyes of Users,,https://youtu.be/7o4rXQPRC-0
Chris Trzesniewski,VinnytsiaJS,english,,2019,Custom RxJS operators,,https://youtu.be/MwM5T9dWNqw
Lea Verou,KharkivCSS,english,,2019,The Web Design Cheat Code: Using SVG to bridge CSS’ gaps,,https://youtu.be/PNVygpWE4lI
Chris Lilley,KharkivCSS,english,,2019,WebFonts in 2019: Everything Changes,,https://youtu.be/Nb0C8veF_XE
Дмитро Попов,KharkivCSS,russian,,2019,WCAG: вивчаємо основи веб-доступності на практиці,,https://youtu.be/5yc42rjnYtQ
Антон Немцев,KharkivCSS,russian,,2019,Логування продуктивності відповідно до стандартів,,https://youtu.be/TarJKIJFlgA
Никита Дубко,KharkivCSS,russian,,2019,"Houdini — CSS, который JavaScript",,https://youtu.be/xFXCfTHTmoA
Елена Шпилевская,KharkivCSS,russian,,2019,UX як основа усвідомленої верстки,,https://youtu.be/XRtSLTg_q-g
Артём Кобзарь,KharkivJS,russian,,2019,(не|ну)жная монада Either на практике и в теории,,https://youtu.be/S0cCjbWuvzk
Дмитрий Махнёв,KharkivJS,russian,,2019,(не|ну)жная монада Either на практике и в теории,,https://youtu.be/S0cCjbWuvzk
Владимир Рожков,KharkivJS,russian,,2019,Что делать со стеклянным потолком?,,https://youtu.be/6VQUT0lwFSs
Алексей Мигутский,KharkivJS,russian,,2019,Есть ли жизнь после Senior?,,https://youtu.be/CiSLUYwdyac
Илья Климов,KharkivJS,russian,,2019,Взгляд на VueJS изнутри,,https://youtu.be/FaLNqrHYbXg
Наталья Теплухина,KharkivJS,russian,,2019,The magic of RxJS,,https://youtu.be/WLBHVwnAJZ8
Алексей Богачук,KharkivJS,russian,,2019,Solution Architecture и JavaScript,,https://youtu.be/af9W4LPPN7c
Максим Корецкий,KharkivJS,russian,,2019,Front end development and change detection,,https://youtu.be/zK7ah1f6oTU
Максим Безуглый,KharkivJS,russian,,2019,Архитектура и иллюзии. Joker и супергерои JavaScript,,https://youtu.be/reIG6asIWAY
Степан Суворов,KharkivJS,russian,,2019,Безопасность в Web,,https://youtu.be/-8XVAAVYj7s
Наталья Теплухина,KharkivJS,russian,,2019,Hooked into Vue 3 function-based API,,https://youtu.be/ZTHdIrtaVS8
Никита Галкин,KharkivJS,russian,,2019,The Twelve Factors App for Node.js Developers,,https://youtu.be/i4Rf9ng-dcc
Yoni Goldberg,KharkivJS,english,,2019,"JavaScript Testing: Latest 2019 trends, techniques and opportunities",,https://youtu.be/y9Y7bQnxYQY
Валерий Сорокобатько,KharkivJS,russian,,2019,React Contexts like a pattern,,https://youtu.be/Mu8TBwU3QaA
Алексей Степченков,KharkivJS,russian,,2019,JAMstack и с чем его едят,,https://youtu.be/b1ZnAmIXXAQ
Андрей Чиж,KharkivJS,russian,,2019,Tips and tricks for making high-performance Node.js applications,,https://youtu.be/EtVJZyeDziQ
Сергей Бабич,KharkivJS,russian,,2019,Batman vs Poison Ivy,,https://youtu.be/uVofsYmNxhY
Devlin Duldulao,KharkivJS,english,,2019,"Svelte, a lightweight modern JavaScript library for building web applications",,https://youtu.be/UoNybjskx00
Сергей Рожков,KharkivJS,russian,,2019,Soft skills for software developers,,https://youtu.be/UXmBKL_tnYQ
Виктор Турский,KharkivJS,russian,,2019,Еще одна невозможная задача или история создания собственного движка,,https://youtu.be/_ci7rnpCGrM
Алексей Руденко,KharkivJS,russian,,2019,Fog of War,,https://youtu.be/Iv10GnzwYQ4
Всеволод Родионов,KharkivJS,russian,,2019,Math driven development,,https://youtu.be/Y62qOxcJPPA
Кристина Ландвитович,KharkivJS,russian,,2019,Tensorflow in action,,https://youtu.be/Zj5qhow49AA
Karan Thakkar,KharkivJS,english,,2019,React Native at Skyscanner: The Good Parts,,https://youtu.be/Zyqn6UOcvWY
Павел Черторогов,KharkivJS,russian,,2019,GraphQL: фрагментная модель на клиенте,,https://youtu.be/RQR_6NW_xvo
Кирилл Соколов,KharkivJS,russian,,2019,"Cypress: fast, easy and reliable testing",,https://youtu.be/KJpzrnIap1E
Leo Hrabovetskiy,KharkivJS,ukranian,,2019,Party for the 3rd party,,https://youtu.be/mK4CKWvA17k
Станислав Долгачев,KharkivJS,russian,,2019,Offline by heart,,https://youtu.be/3QNOVt6-t-U
Владлен Федосов,KharkivJS,russian,,2019,Flaws of the Web Components in 2019 and how to address them,,https://youtu.be/BOiJVfTD8F0
James Milner,KharkivJS,english,,2019,We Need to Talk about the Main Thread,,https://youtu.be/dzqt-W365VM
Стас Марков,KharkivJS,russian,,2019,GraalVM - платформа для выполнения не только лишь Java,,https://youtu.be/mwoLFLz6tFI